{
  "$schema": "https://json-schema.org/draft/2020-12/schema",
  "title": "FlyPython catalog export",
  "type": "object",
  "additionalProperties": false,
  "required": ["$schema", "schema_version", "catalog", "paths", "resources"],
  "properties": {
    "$schema": {
      "const": "./schema/catalog-v1.schema.json"
    },
    "schema_version": {
      "const": 1
    },
    "catalog": {
      "type": "object",
      "additionalProperties": false,
      "required": ["reviewed_on", "status"],
      "properties": {
        "reviewed_on": {
          "type": "string",
          "format": "date"
        },
        "status": {
          "const": "active"
        }
      }
    },
    "paths": {
      "type": "array",
      "minItems": 4,
      "maxItems": 4,
      "items": {
        "$ref": "#/$defs/path"
      }
    },
    "resources": {
      "type": "array",
      "minItems": 1,
      "items": {
        "$ref": "#/$defs/resource"
      }
    }
  },
  "$defs": {
    "localizedPath": {
      "type": "string",
      "enum": ["foundations", "web-apis", "automation", "ai-agents"]
    },
    "path": {
      "type": "object",
      "additionalProperties": false,
      "required": ["id", "order", "title_en", "title_zh", "summary_en", "summary_zh"],
      "properties": {
        "id": {
          "$ref": "#/$defs/localizedPath"
        },
        "order": {
          "type": "integer",
          "minimum": 1
        },
        "title_en": {
          "type": "string",
          "minLength": 1
        },
        "title_zh": {
          "type": "string",
          "minLength": 1
        },
        "summary_en": {
          "type": "string",
          "minLength": 1
        },
        "summary_zh": {
          "type": "string",
          "minLength": 1
        }
      }
    },
    "resource": {
      "type": "object",
      "additionalProperties": false,
      "required": [
        "id",
        "path",
        "title",
        "url",
        "source_type",
        "level",
        "language",
        "why_en",
        "why_zh",
        "reviewed_on",
        "status",
        "requires_key",
        "risk",
        "featured",
        "order"
      ],
      "properties": {
        "id": {
          "type": "string",
          "pattern": "^[a-z0-9]+(?:-[a-z0-9]+)*$"
        },
        "path": {
          "$ref": "#/$defs/localizedPath"
        },
        "title": {
          "type": "string",
          "minLength": 1
        },
        "url": {
          "type": "string",
          "format": "uri",
          "pattern": "^https://"
        },
        "source_type": {
          "type": "string",
          "enum": ["official-docs", "official-standard", "official-project"]
        },
        "level": {
          "type": "string",
          "enum": ["beginner", "intermediate", "advanced", "all-levels"]
        },
        "language": {
          "type": "string",
          "enum": ["en", "zh", "multilingual"]
        },
        "why_en": {
          "type": "string",
          "minLength": 1
        },
        "why_zh": {
          "type": "string",
          "minLength": 1
        },
        "reviewed_on": {
          "type": "string",
          "format": "date"
        },
        "status": {
          "const": "active"
        },
        "requires_key": {
          "type": "boolean"
        },
        "risk": {
          "type": "string",
          "enum": ["low", "medium"]
        },
        "featured": {
          "type": "boolean"
        },
        "order": {
          "type": "integer",
          "minimum": 1
        }
      }
    }
  }
}
